Course Name,Certificate Provider,Certification Level,Certification Type,Duration,Certification Rating,Skills
IBM Data Engineering,IBM,['Débutant '],[' Certificat Professionnel '],[' 3 à 6\xa0mois'],"Compétences que vous acquerrez: Data Engineering, Data Modeling, Data Pipelines, Extract, Transform, Load, Data Warehousing, Data Architecture, PySpark, Data Integration, Data Processing, Big Data, Star Schema, Analytics, Apache Spark, Feature Engineering, Data Management, Data Science, Information Management, Database Management Systems, Database Systems, Database Management","Programmation en Python, Schéma en étoile, Entreposage de données, Ingénierie des données, Bases de données relationnelles, Administration de base de données, Administration des bases de données, SQL, Big Data, NoSQL, Apache Hadoop, IBM Cognos Analytics, Programmation Python, Script Shell, Systèmes de base de données, Commandes Linux, Data Mart, Pipelines de données, Extrait, Bash (langage de script), Apache Spark, Compétences en matière d'entretien"
Fondements de l'ingénierie des données,IBM,['Débutant '],[' Spécialisation '],[' 3 à 6\xa0mois'],Compétences que vous acquerrez: Machine Learning,"Bases de données, Infrastructure de données, Programmation en Python, Ingénierie des données, Récupération de données sur le Web, Bases de données relationnelles, Manipulation des données, Manipulation de données, SQL, NumPy, Gestion des bases de données, Systèmes de gestion de bases de données, Pandas (paquetage Python), Programmation Python, Architecture des données, Magasin de données, Systèmes de base de données, Conception de la base de données, Théorie des bases de données, Base de données, Pipelines de données, Extrait, Web scraping"
DeepLearning.AI Data Engineering,Plusieurs enseignants,['Intermédiaire '],[' Certificat Professionnel '],[' 3 à 6\xa0mois'],"Compétences que vous acquerrez: Generative AI, Scikit Learn (Machine Learning Library), Keras (Neural Network Library), Machine Learning Algorithms, Predictive Modeling, Artificial Intelligence, Supervised Learning, Machine Learning, Python Programming, Artificial Neural Networks, Artificial Intelligence and Machine Learning (AI/ML), Deep Learning, Data Analysis, Statistical Machine Learning, Applied Machine Learning, Machine Learning Methods, ChatGPT, Analytics, Natural Language Processing, Flask (Web Framework)","Data Engineering, Data Store, Data Pipelines, Data Storage Technologies, Data Modeling, Data Architecture, Amazon Web Services, Data Storage, Data Infrastructure, Query Languages, Extract, Transform, Load, Data Warehousing, Cloud Engineering, Apache Airflow, Databases, PySpark, Database Management Systems, Data Processing, Data Lakes, Data Integration"
Introduction à l’ingénierie des données,IBM,['Débutant '],[' Cours '],[' 1 à 4\xa0semaines'],no information :/,"Bases de données, Gestion des données, Infrastructure de données, Ingénierie des données, Entreposage de données, Technologies de stockage des données, Magasin de données, Gestion de l'information, Big Data, Bases de données opérationnelles, Systèmes de gestion de bases de données, IBM DB2, Architecture des données, Lacs de données, Intégration de données, Intégration des données, Traitement des données, Cartographie des données, Data Mart, Pipelines de données, Extrait"
Introduction to Data Engineering,DeepLearning.AI,['Intermédiaire '],[' Cours '],[' 1 à 4\xa0semaines'],"Compétences que vous acquerrez: Ingénierie d'essai, Amazon Web Services, Outils de développement de logiciels, Programmation en Python, Applications en nuage, CI/CD, DevOps, Ingénierie des données, Conteneurisation, Ingénierie des nuages, Outils Devops, Big Data, Programmation informatique, AWS SageMaker, Programmation Python, Programmation Informatique, Jupyter, Cloud Native Computing, MLOps (Apprentissage automatique), Traitement des données, Devops, Microservices, Déploiement des applications","Data Engineering, Data Pipelines, Data Architecture, Amazon Web Services, Data Infrastructure, Cloud Engineering, Extract, Transform, Load, Cloud Infrastructure, Data Integration, Databases, Cloud Services, Big Data, Data Processing, Cloud Solutions, Information Technology Architecture, Cloud Platforms, Infrastructure Architecture, Data Storage, Cloud Applications, Public Cloud"
"Essentiels de Python, Bash et SQL pour l'ingénierie des données",Duke University,['Débutant '],[' Spécialisation '],[' 3 à 6\xa0mois'],"Compétences que vous acquerrez: Gestion des données, Transformation numérique, Bases de données, Qualité des données, Ingénierie des données, Gouvernance des données, Intégrité des données, Traitement des données, Gestion de l'information, Big Data, Architecture des données, Intégration de données, Intégration des données, Gouvernance de données, Cartographie des données, Stockage des données, Gestion des métadonnées, Data wrangling, Stratégie en matière de données, Pipelines de données, Extrait, Transformation des données, Transformation de données","Langage de requête, Programmation en Python, Ingénierie des données, Récupération de données sur le Web, Commandes Unix, Linux, Environnement de développement, Programmation Python, Manipulation des données, Manipulation de données, Pandas (paquetage Python), SQL, Administration Linux, Web scraping, Shell Unix, Script Shell, Commandes Linux, Jupyter, MySQL, Scripting, MLOps (Apprentissage automatique), Microservices, Bash (langage de script)"
Data Engineering on AWS - Foundations,Amazon Web Services,['Débutant '],[' Cours '],[' 1 à 4\xa0semaines'],"Compétences que vous acquerrez: Apprentissage automatique, Intelligence artificielle, CI/CD, Gestion des versions, Science des données, Intelligence artificielle et apprentissage automatique (IA/ML), Cycle de vie du développement logiciel, Ingénierie des données, Livraison continue, Apprentissage automatique appliqué, Logiciel d'apprentissage automatique, Déploiement continu, Architecture des données, Données non structurées, Gestion du cycle de vie des applications, Déploiement des applications, Cycle de vie du développement des systèmes, MLOps (Apprentissage automatique), Pipelines de données, Extrait","Data Engineering, Cloud Engineering, Amazon Web Services, Data Architecture, Cloud Infrastructure, Cloud Services, Cloud Platforms, Data Management, Cloud Computing, Big Data, Cloud Computing Architecture"
